название модели,марковская схема,"как вычисляется постсинаптический ток проводимость g(P, ...) и постсинаптический ток I",значения для параметров,список определений функций на ребрах марковской цепи,краткое описание что это за синапс,Источник
AMPA/kainate (2-state),$C \leftrightarrow O$,$I = \bar{g} \cdot O \cdot (V - E_{rev})$,"$r_1 = 1100 \, s^{-1}mM^{-1}$ ,  $r_2 = 190 \, s^{-1}$ ,  $E_{rev} = 0 \, mV$",$r_1$ : скорость связывания лиганда ( $L$ );  $r_2$ : скорость диссоциации,"Быстрый глутаматергический синапс, простая кинетическая модель без учета десенситизации.",1
AMPA/kainate (6-state),"$C \leftrightarrow C_1 \leftrightarrow C_2 \leftrightarrow O$ ;  $C_1 \leftrightarrow D_1$ ,  $C_2 \leftrightarrow D_2$ ,  $D_1 \leftrightarrow D_2$",$I = \bar{g} \cdot O \cdot (V - E_{rev})$,"$r_1=2 \cdot 10^4, r_2=1300, r_3=10^4, r_4=2600, r_5=900, r_6=500, r_7=10^4, r_8=0.2, r_9=2, r_{10}=0.1$  (все в  $s^{-1}$  или  $s^{-1}mM^{-1}$ )","$r_1, r_3, r_7, r_9$ : константы связывания;  $r_2, r_4, r_8, r_{10}$ : константы диссоциации;  $r_5, r_6$ : константы открытия и закрытия канала","Детальная модель глутаматного рецептора, включающая несколько закрытых (C) и десенситизированных (D) состояний.",1
NMDA (2-state),$C \leftrightarrow O$,"$I = \bar{g} \cdot B(V) \cdot O \cdot (V - E_{rev})$ , где  $B(V) = (1 + \exp(-0.062 \cdot V) \cdot Mg^{2+} / 3.57)^{-1}$","$r_1 = 72 \, s^{-1}mM^{-1}$ ,  $r_2 = 6.6 \, s^{-1}$ ,  $E_{rev} = 0 \, mV$",$r_1$ : скорость связывания лиганда ( $L$ );  $r_2$ : скорость диссоциации,Глутаматергический синапс с медленной кинетикой и потенциалозависимым блоком ионами  $Mg^{2+}$ .,1
GABA $_A$  (2-state),$C \leftrightarrow O$,$I = \bar{g} \cdot O \cdot (V - E_{rev})$,"$r_1 = 530 \, s^{-1}mM^{-1}$ ,  $r_2 = 180 \, s^{-1}$ ,  $E_{rev} = -80 \, mV$",$r_1$ : скорость связывания ГАМК;  $r_2$ : скорость диссоциации,"Быстрый тормозный синапс, опосредованный ионотропными рецепторами ГАМК типа А.",1
GABA $_B$  (G-protein gated),$C \leftrightarrow O$  (активация K+ канала G-белком),"$I = \bar{g} \cdot \frac{G^n}{G^n + K_d} \cdot (V - E_{rev})$ , где  $G$  — концентрация активированного G-белка.","$r_1 = 16 \, s^{-1}\mu M^{-1}$ ,  $r_2 = 4.7 \, s^{-1}$ , длительность импульса G-белка = 84 ms",$r_1$ : скорость связывания активированного G-белка с каналом;  $r_2$ : скорость диссоциации,"Медленный тормозный синапс, работающий через метаботропные рецепторы и каскад G-белков.",1